{
  "definitions": {},
  "$schema": "http://json-schema.org/draft-04/schema#",
  "id": "http://example.com/example.json",
  "type": "object",
  "properties": {
    "appLocation": {
      "id": "/properties/appLocation",
      "type": "string"
    },
    "inputLocation": {
      "id": "/properties/inputLocation",
      "type": "string"
    },
    "outputLocation": {
      "id": "/properties/outputLocation",
      "type": "string"
    },
    "paramsList": {
      "id": "/properties/optionList",
      "type": "array",
      "items": {
        "id": "/properties/optionList/items",
        "type": "object",
        "properties": {
          "name": {
            "id": "/properties/optionList/items/properties/name",
            "type": "string"
          },
          "shortHand": {
            "id": "/properties/optionList/items/properties/shortHand",
            "type": "string"
          },
          "value": {
            "id": "/properties/optionList/items/properties/value",
            "type": "string"
          },
          "description": {
            "id": "/properties/optionList/items/properties/description",
            "type": "string"
          }
        }
      }
    }
  }
}